{
  "registry_version": "0.1",
  "query_time": "2026-04-30T18:07:00Z",
  "registry_metadata": {
    "registry_type": "country",
    "capabilities": {
      "can_onboard_nodes": true,
      "can_relay_sources": true,
      "can_curate_active_index": true,
      "can_moderate_directory": false,
      "can_issue_trust_claims": false,
      "can_reexport_sources": false
    },
    "scope": {
      "vertical_id": "pizza4people",
      "country_code": "DK"
    },
    "delegated_by_registry_url": "https://umbrella.protocols4people.com"
  },
  "records": [
    {
      "source_registry_url": "https://registry-a.pizza4people.com",
      "source_relay_registry_url": "https://umbrella.protocols4people.com",
      "decision": "deny",
      "reason": "Temporarily hidden in this country scope",
      "set_by": "country-curator",
      "expires_at": "2026-05-07T18:07:00Z",
      "set_at": "2026-04-30T18:06:00Z"
    }
  ]
}
